{
  "session_id": "550e8400-e29b-41d4-a716-446655440000",
  "log_entry": "Kael enters the dimly lit tavern and orders a flagon of mead from the gruff bartender.",
  "updates": [
    {
      "target_file": "data/state/core/entities/kael.json",
      "operation": "update",
      "data": {
        "current_location": "trog-tavern",
        "status": "alive"
      }
    }
  ],
  "metadata": {
    "agent": "fact-extractor",
    "turn_number": 1,
    "confidence": 0.95
  }
}
